{
  "$schema": "https://json-schema.org/draft/2020-12/schema",
  "$id": "https://raw.githubusercontent.com/khaledaltheeb/rawafid-arabic-rtl-a11y-toolkit/main/schemas/localization-contract.schema.json",
  "title": "Rawafid localization QA contract",
  "type": "object",
  "additionalProperties": false,
  "required": ["schemaVersion", "contract", "referenceLocale", "checks", "nonClaims"],
  "properties": {
    "schemaVersion": {"const": 1},
    "contract": {"type": "string", "minLength": 1},
    "referenceLocale": {"type": "string", "minLength": 2},
    "checks": {
      "type": "array",
      "minItems": 1,
      "items": {
        "type": "object",
        "additionalProperties": false,
        "required": ["id", "severity", "purpose"],
        "properties": {
          "id": {"type": "string", "pattern": "^[a-z0-9][a-z0-9-]+$"},
          "severity": {"enum": ["error", "warning", "info"]},
          "purpose": {"type": "string", "minLength": 1}
        }
      }
    },
    "nonClaims": {"type": "array", "minItems": 1, "items": {"type": "string", "minLength": 1}}
  }
}
